{
  "schema": "contextlean.profile/v1",
  "invariants": [
    {
      "id": "current-canonical-wins",
      "description": "Current canonical files and live evidence outrank memory or summaries."
    },
    {
      "id": "privacy-and-credentials",
      "description": "Do not expose credentials, login state, private sessions, or sensitive user content."
    },
    {
      "id": "external-write-approval",
      "description": "Require explicit authority before external writes or account-level changes."
    },
    {
      "id": "dirty-worktree-protection",
      "description": "Preserve unrelated and uncommitted user changes."
    },
    {
      "id": "network-node-stability",
      "description": "Do not change VPN or proxy selector state without explicit approval and restoration."
    },
    {
      "id": "model-reasoning-stability",
      "description": "Do not change the selected model or reasoning level as part of context optimization."
    }
  ],
  "objectives": [
    "Reject unsafe candidates before the full frozen evaluation."
  ],
  "qualityGates": {
    "requiredCategoryPasses": {
      "instruction": 3,
      "skill_positive": 1,
      "skill_negative": 1,
      "context_pack": 1
    },
    "minBlindNonInferior": 5,
    "maxBlindLosses": 0,
    "minBlindNetWins": 1,
    "minInputTokenImprovementPct": 5,
    "minToolImprovementPct": 10,
    "minLatencyImprovementPct": 10,
    "maxOtherRegressionPct": 10
  }
}
